<?xml version="1.0" encoding="utf-8"?>
<set xmlns:xsi="http://www.w3.org/2001/XMLSchema-instance"
	xmlns="Alpha:Behavior"
	xsi:schemaLocation="Alpha:Behavior behavior_configure.xsd">
	<action
		order="1"
		action="右抬腿"
		delay="10"
		repeat="0"/>
	<music
		order="2"
		uri="http://www.baidu.com/"
		delay="20"
		repeat="0" />
	<tts
		order="1"
		text="嘿，看我右抬腿"
		volume="80"
		speed="64"
		delay="20"
		voicer="nannan"
		mood=""
		repeat="0" />
	<led
		order="3"
		position="head"
		number="01"
		effect="horse"
		delay="20"
		ontime="500"
		runtime="5000"
		color="red"
		secondColor="blue"
		bright="9"
		repeat="1"/>
	<set
		order="5"
		delay="30"
		repeat="0">
		<action
			order="1"
			action="左抬腿"
			delay="20"
			repeat="0"/>
		<tts
			order="1"
			text="嘿，看我左抬腿"
			volume="80"
			speed="64"
			delay="20"
			mood=""/>
		<music
			order="1"
			uri="file:///actions/xxx.mp3"
			delay="30"
			repeat="0"/>
		<led
			order="1"
			position="eye"
			number="01"
			effect="horse"
			delay="0"
			ontime="1000"
			runtime="4000"
			color="yellow"
			bright="9"
			repeat="0"/>
	</set>
</set>